{
  "schema_version": 1,
  "profile": "facsimile-spread/v1",
  "doc_id": "fixture_ms",
  "identity": {
    "title": "Deterministic Codex",
    "author": "Archive Scribe",
    "archive": "fixture",
    "shelfmark": "MS 1",
    "date": "1200"
  },
  "languages": {
    "original": "la",
    "translation": "en"
  },
  "readers_note": "A one-leaf conformance manuscript.",
  "folios": [
    {
      "page_id": "p001",
      "order": 1,
      "images": {
        "original": {
          "kind": "page_image",
          "page_id": "p001",
          "fingerprint": "f3c3e158fe40c2ff",
          "source_url": "https://example.invalid/iiif/deterministic-fixture/full/full/0/default.jpg"
        },
        "enhanced": {
          "kind": "page_image_clean",
          "page_id": "p001",
          "fingerprint": "f3c3e158fe40c2ff"
        }
      },
      "evidence": {
        "diplomatic": {
          "text": "alpha beta\ngamma",
          "audit": {
            "candidate_readings": [
              {
                "model": "fixture-read-v1",
                "raw_text": "alpha beta\ngamma",
                "requested_model": "fixture-read-v1",
                "role": "primary",
                "text": "alpha beta\ngamma"
              }
            ],
            "adjudication_status": "not_configured",
            "adjudication_requested_model": null,
            "adjudication_model": null,
            "adjudication_reasoning": "",
            "unresolved": [],
            "adjudication_error": null
          },
          "source": {
            "kind": "page_transcription",
            "pointer": "/text",
            "fingerprint": "5381fec15061cc79"
          }
        },
        "translation": {
          "text": "Alpha beta. Gamma.",
          "notes": "",
          "flags": {},
          "seam": null,
          "source": {
            "kind": "page_translation",
            "pointer": "/translation",
            "fingerprint": "e8f3407101085818"
          }
        }
      }
    }
  ],
  "sections": [
    {
      "id": "section-0001",
      "order": 1,
      "heading": "First Leaf",
      "folio_ids": [
        "p001"
      ],
      "content": {
        "translation": {
          "text": "Alpha beta. Gamma.",
          "source": {
            "kind": "edition",
            "pointer": "/sections/0/translation",
            "fingerprint": "2144ec60016bd32e"
          }
        },
        "emended_reading": {
          "text": "alpha beta\ngamma",
          "source": {
            "kind": "emendations",
            "pointer": "/sections/0/reading",
            "fingerprint": "664bd460df1e487b"
          }
        },
        "diplomatic_transcription": {
          "text": "alpha beta\ngamma",
          "source": {
            "kind": "manuscript",
            "pointer": "/sections/0/original",
            "fingerprint": "b687d9032e91ce16"
          }
        }
      },
      "apparatus_ids": []
    }
  ],
  "apparatus": [],
  "colophon": {
    "transcribed_by": "fixture-read-v1",
    "translated_by": "fixture-translate-v1",
    "referenced_by": "fixture-reference-v1",
    "emended_by": "fixture-emend-v1",
    "finalized_by": "fixture-finalize-v1",
    "pipeline": [
      {
        "station": "read",
        "runs": 1,
        "tokens_in": 10,
        "tokens_out": 5,
        "cost_usd": 0.01,
        "cost_complete": true,
        "cost_usd_known": 0.01,
        "configurations": [
          {
            "station_fingerprint": "read-fixture-source-v1",
            "config_fingerprint": "read-fixture-config-v1",
            "model": "fixture-read-v1",
            "prompt_name": "read/fixture-v1",
            "prompt_sha256": "549387fcb0a6a2dae64546141d856ab5f3a6d6f9870b201007bf8a96804a529b",
            "params": {}
          }
        ]
      },
      {
        "station": "translate",
        "runs": 1,
        "tokens_in": 10,
        "tokens_out": 5,
        "cost_usd": 0.02,
        "cost_complete": true,
        "cost_usd_known": 0.02,
        "configurations": [
          {
            "station_fingerprint": "translate-fixture-source-v1",
            "config_fingerprint": "translate-fixture-config-v1",
            "model": "fixture-translate-v1",
            "prompt_name": "translate/fixture-v1",
            "prompt_sha256": "015e693f3d52f365451cee6c3311ca1ebf7ddfeb2c26cb9b69f2cf06e4881970",
            "params": {}
          }
        ]
      },
      {
        "station": "survey",
        "runs": 1,
        "tokens_in": 10,
        "tokens_out": 5,
        "cost_usd": 0.01,
        "cost_complete": true,
        "cost_usd_known": 0.01,
        "configurations": [
          {
            "station_fingerprint": "survey-fixture-source-v1",
            "config_fingerprint": "survey-fixture-config-v1",
            "model": "fixture-survey-v1",
            "prompt_name": "survey/fixture-v1",
            "prompt_sha256": "2af8079d4598491433c032e7c6ed71fb33c0184f5337ca036fbf1720d9bb9e23",
            "params": {}
          }
        ]
      },
      {
        "station": "reconstruct",
        "runs": 1,
        "tokens_in": 10,
        "tokens_out": 5,
        "cost_usd": 0.03,
        "cost_complete": true,
        "cost_usd_known": 0.03,
        "configurations": [
          {
            "station_fingerprint": "reconstruct-fixture-source-v1",
            "config_fingerprint": "reconstruct-fixture-config-v1",
            "model": "fixture-reconstruct-v1",
            "prompt_name": "reconstruct/fixture-v1",
            "prompt_sha256": "aaee6e952d1e59f3885524ba35e04648e101d04abcfa58aded881cc661bcf13a",
            "params": {}
          }
        ]
      },
      {
        "station": "reference",
        "runs": 1,
        "tokens_in": 10,
        "tokens_out": 5,
        "cost_usd": 0.01,
        "cost_complete": true,
        "cost_usd_known": 0.01,
        "configurations": [
          {
            "station_fingerprint": "reference-fixture-source-v1",
            "config_fingerprint": "reference-fixture-config-v1",
            "model": "fixture-reference-v1",
            "prompt_name": "reference/fixture-v1",
            "prompt_sha256": "6c1222b5d2ae1d31752d5fc92205a1445aecc1ead70e26d08be0b763ebb23465",
            "params": {}
          }
        ]
      },
      {
        "station": "emend",
        "runs": 1,
        "tokens_in": 10,
        "tokens_out": 5,
        "cost_usd": 0.01,
        "cost_complete": true,
        "cost_usd_known": 0.01,
        "configurations": [
          {
            "station_fingerprint": "emend-fixture-source-v1",
            "config_fingerprint": "emend-fixture-config-v1",
            "model": "fixture-emend-v1",
            "prompt_name": "emend/fixture-v1",
            "prompt_sha256": "441de77c11722156f3d21d6a3ace3e44b7fec53f83145b672ba720c6abde596f",
            "params": {}
          }
        ]
      },
      {
        "station": "finalize_edition",
        "runs": 1,
        "tokens_in": 12,
        "tokens_out": 6,
        "cost_usd": 0.04,
        "cost_complete": true,
        "cost_usd_known": 0.04,
        "configurations": [
          {
            "station_fingerprint": "finalize-fixture-source-v1",
            "config_fingerprint": "finalize-fixture-config-v1",
            "model": "fixture-finalize-v1",
            "prompt_name": "finalize/fixture-v1",
            "prompt_sha256": "07b9eeddf0c43a95cb48ef6dce528d6ee02454df717e82269fbf0b91b258772f",
            "params": {}
          }
        ]
      }
    ],
    "cost_usd_total": 0.13,
    "cost_usd_known": 0.13,
    "cost_complete": true,
    "pages": 1
  }
}